term;description;casesensitive;translatable;forbidden;tags;en-US;en-US_description;th-TH;th-TH_description
TOTAL;;no;yes;no;;TOTAL;;รวมทั้งหมด;
Tag;;no;yes;no;;Tag;;แท็ก;
Tag library;;no;yes;no;;Tag library;;แท็กไลบรารี;
Tags;;no;yes;no;;Tags;;แท็ก;
Talent Review;;no;yes;no;;Talent Review;;การทบทวนศักยภาพบุคลากร;
Target;;no;yes;no;;Target;;เป้าหมาย;
Target bonus;;no;yes;no;;Target bonus;;โบนัสเป้าหมาย;
Target budget;;no;yes;no;;Target budget;;งบประมาณเป้าหมาย;
Team planner view;;no;yes;no;;Team planner view;;มุมมองแพลนเนอร์ของทีม;
Team requests;;no;yes;no;;Team requests;;คำขอทีม;
Template;;no;yes;no;;Template;;เทมเพลต;
Template document;;no;yes;no;;Template document;;เอกสารแม่แบบ;
Template widget settings;;no;yes;no;;Template widget settings;;การตั้งค่าวิดเจ็ตแม่แบบ;
Templates;;no;yes;no;;Templates;;เทมเพลต;
Text;;no;yes;no;;Text;;ข้อความ;
Text field;;no;yes;no;;Text field;;ฟิลด์ข้อความ;
Thanks;;no;yes;no;;Thanks;;ขอบคุณ;
Then;;no;yes;no;;Then;;จากนั้น;
Time in role;;no;yes;no;;Time in role;;ระยะเวลาในบทบาท;
Time zone;;no;yes;no;;Time zone;;โซนเวลา;
Timeline;;no;yes;no;;Timeline;;ไทม์ไลน์;
Title;;no;yes;no;;Title;;ชื่อ;
Today;;no;yes;no;;Today;;วันนี้;
Toggle;;no;yes;no;;Toggle;;สลับ;
Total;;no;yes;no;;Total;;ทั้งหมด;
Total behaviors;;no;yes;no;;Total behaviors;;พฤติกรรมทั้งหมด;
Total compensation;;no;yes;no;;Total compensation;;ผลตอบแทนรวม;
Total entities;;no;yes;no;;Total entities;;เอนทิตีทั้งหมด;
Total goals;;no;yes;no;;Total goals;;จำนวนประตูทั้งหมด;
Total reviews;;no;yes;no;;Total reviews;;การประเมินทั้งหมด;
Total score;;no;yes;no;;Total score;;คะแนนรวม;
Total workers;;no;yes;no;;Total workers;;จำนวนพนักงานทั้งหมด;
Tracking;;no;yes;no;;Tracking;;การติดตาม;
Tracking status;;no;yes;no;;Tracking status;;สถานะการติดตาม;
Training data;;no;yes;no;;Training data;;ข้อมูลการฝึกอบรม;
Trend;;no;yes;no;;Trend;;แนวโน้ม;
True;;no;yes;no;;True;;จริง;
Trust;;no;yes;no;;Trust;;ความไว้วางใจ;
Try again;;no;yes;no;;Try again;;ลองอีกครั้ง;
Type;;no;yes;no;;Type;;ประเภท;
Type part of a name;;no;yes;no;;Type part of a name;;พิมพ์ส่วนหนึ่งของชื่อ;
Type weight;;no;yes;no;;Type weight;;ประเภทน้ำหนัก;
Type your message here;;no;yes;no;;Type your message here;;พิมพ์ข้อความของคุณที่นี่;
Types;;no;yes;no;;Types;;ประเภท;
Unavailable;;no;yes;no;;Unavailable;;ไม่พร้อมใช้งาน;
Unclear;;no;yes;no;;Unclear;;ไม่ชัดเจน;
Under review;;no;yes;no;;Under review;;อยู่ระหว่างการประเมินผลงาน;
Unexpected error;;no;yes;no;;Unexpected error;;เกิดข้อผิดพลาดที่ไม่คาดคิด;
Unhelpful;;no;yes;no;;Unhelpful;;ไม่มีประโยชน์;
Unique logins;;no;yes;no;;Unique logins;;การเข้าสู่ระบบแบบไม่ซ้ำ;
Unit;;no;yes;no;;Unit;;หน่วย;
Unrated;;no;yes;no;;Unrated;;ไม่ได้รับการจัดอันดับ;
Unrelease;;no;yes;no;;Unrelease;;ยกเลิกการเผยแพร่;
Unreleased;;no;yes;no;;Unreleased;;ยังไม่ได้เผยแพร่;
Unsaved changes;;no;yes;no;;Unsaved changes;;การเปลี่ยนแปลงที่ยังไม่ได้บันทึก;
Unselect all;;no;yes;no;;Unselect all;;ยกเลิกการเลือกทั้งหมด;
Upcoming;;no;yes;no;;Upcoming;;กำลังจะเกิดขึ้น;
Upcoming check-ins;;no;yes;no;;Upcoming check-ins;;การเช็คอินที่กําลังจะมาถึง;
Update;;no;yes;no;;Update;;อัปเดต;
Updated;;no;yes;no;;Updated;;อัปเดตแล้ว;
Updated by;;no;yes;no;;Updated by;;อัปเดตโดย;
Upload;;no;yes;no;;Upload;;อัปโหลด;
Upload behavior;;no;yes;no;;Upload behavior;;อัปโหลดพฤติกรรม;
Upload file;;no;yes;no;;Upload file;;อัปโหลดไฟล์;
Upload the completed file;;no;yes;no;;Upload the completed file;;อัปโหลดไฟล์ที่เสร็จสมบูรณ์;
Upload the modified Excel file;;no;yes;no;;Upload the modified Excel file;;อัปโหลดไฟล์ Excel ที่แก้ไขแล้ว;
Uploaded by;;no;yes;no;;Uploaded by;;อัปโหลดโดย;
Uploaded files;;no;yes;no;;Uploaded files;;ไฟล์ที่อัปโหลด;
Uploading;;no;yes;no;;Uploading;;กำลังอัปโหลด;
Usage;;no;yes;no;;Usage;;การใช้งาน;
Usage details;;no;yes;no;;Usage details;;รายละเอียดการใช้งาน;
Used;;no;yes;no;;Used;;ใช้แล้ว;
Used in;;no;yes;no;;Used in;;ใช้ใน;
Useful information;;no;yes;no;;Useful information;;ข้อมูลที่เป็นประโยชน์;
User;;no;yes;no;;User;;ผู้ใช้;
User Security;;no;yes;no;;User Security;;ความปลอดภัยของผู้ใช้;
User local time;;no;yes;no;;User local time;;เวลาท้องถิ่นของผู้ใช้;
Username;;no;yes;no;;Username;;ชื่อผู้ใช้;
Users;;no;yes;no;;Users;;ผู้ใช้;
Users who sent feedback;;no;yes;no;;Users who sent feedback;;ผู้ใช้ที่ส่งคำติชม;
Users with no goals;;no;yes;no;;Users with no goals;;ผู้ใช้ที่ไม่มีเป้าหมาย;
Validation;;no;yes;no;;Validation;;การตรวจสอบความถูกต้อง;
Value;;no;yes;no;;Value;;ค่า;
Values;;no;yes;no;;Values;;ค่านิยม;
Version;;no;yes;no;;Version;;เวอร์ชัน;
View;;no;yes;no;;View;;ดู;
View all;;no;yes;no;;View all;;ดูทั้งหมด;
View my received feedback;;no;yes;no;;View my received feedback;;ดูฟีดแบคที่ฉันได้รับ;
View review;;no;yes;no;;View review;;ดูการประเมินผลงาน;
Visibility;;no;yes;no;;Visibility;;การมองเห็น;
Weight;;no;yes;no;;Weight;;น้ำหนัก;
Weighted score;;no;yes;no;;Weighted score;;คะแนนถ่วงน้ำหนัก;
Widget settings;;no;yes;no;;Widget settings;;การตั้งค่าวิดเจ็ต;
Work country;;no;yes;no;;Work country;;ประเทศที่ทำงาน;
Worker;;no;yes;no;;Worker;;พนักงาน;
Worker & manager;;no;yes;no;;Worker & manager;;พนักงานและผู้จัดการ;
Worker ID;;no;yes;no;;Worker ID;;รหัสพนักงาน;
Worker category;;no;yes;no;;Worker category;;หมวดหมู่พนักงาน;
Worker details;;no;yes;no;;Worker details;;รายละเอียดพนักงาน;
Worker name;;no;yes;no;;Worker name;;ชื่อพนักงาน;
Worker self-assessment;;no;yes;no;;Worker self-assessment;;การประเมินตนเองของพนักงาน;
Worker sign-off;;no;yes;no;;Worker sign-off;;การลงนามรับทราบของพนักงาน;
Worker submission;;no;yes;no;;Worker submission;;การส่งงานของพนักงาน;
Workers;;no;yes;no;;Workers;;พนักงาน;
Workflow;;no;yes;no;;Workflow;;เวิร์กโฟลว์;
Workflow section;;no;yes;no;;Workflow section;;ส่วนเวิร์กโฟลว์;
Workflow status;;no;yes;no;;Workflow status;;สถานะเวิร์กโฟลว์;
Workflow step;;no;yes;no;;Workflow step;;ขั้นตอนเวิร์กโฟลว์;
Workflow steps;;no;yes;no;;Workflow steps;;ขั้นตอนของเวิร์กโฟลว์;
Workflow type;;no;yes;no;;Workflow type;;ประเภทเวิร์กโฟลว์;
Year;;no;yes;no;;Year;;ปี;
Years;;no;yes;no;;Years;;ปี;
Your comment;;no;yes;no;;Your comment;;ความคิดเห็นของคุณ;
Your documents;;no;yes;no;;Your documents;;เอกสารของคุณ;
Your email;;no;yes;no;;Your email;;อีเมลของคุณ;
Your observations;;no;yes;no;;Your observations;;การสังเกตของคุณ;
Your view;;no;yes;no;;Your view;;มุมมองของคุณ;
