term;description;casesensitive;translatable;forbidden;tags;en-US;en-US_description;th-TH;th-TH_description
Direct reports;;no;yes;no;;Direct reports;;ผู้ใต้บังคับบัญชา;
Direction;;no;yes;no;;Direction;;ทิศทาง;
Disable;;no;yes;no;;Disable;;ปิดใช้งาน;
Disabled;;no;yes;no;;Disabled;;ปิดใช้งานแล้ว;
Discard;;no;yes;no;;Discard;;ทิ้ง;
Discussion;;no;yes;no;;Discussion;;การสนทนา;
Discussion outcome;;no;yes;no;;Discussion outcome;;ผลการหารือ;
Discussion point;;no;yes;no;;Discussion point;;ประเด็นการสนทนา;
Discussion points;;no;yes;no;;Discussion points;;หัวข้อการสนทนา;
Display name;;no;yes;no;;Display name;;ชื่อที่แสดง;
Distribution;;no;yes;no;;Distribution;;การกระจาย;
Distribution guidelines;;no;yes;no;;Distribution guidelines;;แนวทางการกระจาย;
Document Settings;;no;yes;no;;Document Settings;;การตั้งค่าเอกสาร;
Document Templates;;no;yes;no;;Document Templates;;แม่แบบเอกสาร;
Document generation;;no;yes;no;;Document generation;;การสร้างเอกสาร;
Document name;;no;yes;no;;Document name;;ชื่อเอกสาร;
Document preview;;no;yes;no;;Document preview;;แสดงตัวอย่างเอกสาร;
Document review;;no;yes;no;;Document review;;การประเมินผลงานด้วยอกสาร;
Document settings;;no;yes;no;;Document settings;;การตั้งค่าเอกสาร;
Document status;;no;yes;no;;Document status;;สถานะเอกสาร;
Document template;;no;yes;no;;Document template;;แม่แบบเอกสาร;
Documents;;no;yes;no;;Documents;;เอกสาร;
Done;;no;yes;no;;Done;;เสร็จสิ้น;
Download;;no;yes;no;;Download;;ดาวน์โหลด;
Download CSV;;no;yes;no;;Download CSV;;ดาวน์โหลด CSV;
Download log file;;no;yes;no;;Download log file;;ดาวน์โหลดไฟล์บันทึก;
Download template;;no;yes;no;;Download template;;ดาวน์โหลดเทมเพลต;
Download the template;;no;yes;no;;Download the template;;ดาวน์โหลดเทมเพลต;
Draft;;no;yes;no;;Draft;;แบบร่าง;
Drop-down list;;no;yes;no;;Drop-down list;;รายการดรอปดาวน์;
Due date;;no;yes;no;;Due date;;วันที่ครบกำหนด;
Duplicate;;no;yes;no;;Duplicate;;ทำซ้ำ;
Duplication successful;;no;yes;no;;Duplication successful;;ทำซ้ำสำเร็จ;
Edit;;no;yes;no;;Edit;;แก้ไข;
Edit goal;;no;yes;no;;Edit goal;;แก้ไขเป้าหมาย;
Edit model;;no;yes;no;;Edit model;;แก้ไขโมเดล;
Edit note;;no;yes;no;;Edit note;;แก้ไขหมายเหตุ;
Edited;;no;yes;no;;Edited;;แก้ไขแล้ว;
Editor;;no;yes;no;;Editor;;บรรณาธิการ;
Education;;no;yes;no;;Education;;การศึกษา;
Effective date;;no;yes;no;;Effective date;;วันที่มีผลบังคับใช้;
Eligibility;;no;yes;no;;Eligibility;;คุณสมบัติ;
Eligible;;no;yes;no;;Eligible;;มีสิทธิ์;
Eligible workers;;no;yes;no;;Eligible workers;;พนักงานที่มีคุณสมบัติเหมาะสม;
Else;;no;yes;no;;Else;;อื่นๆ;
Email;;no;yes;no;;Email;;อีเมล;
Email Notifications;;no;yes;no;;Email Notifications;;การแจ้งเตือนทางอีเมล;
Email address;;no;yes;no;;Email address;;ที่อยู่อีเมล;
Email notification;;no;yes;no;;Email notification;;การแจ้งเตือนทางอีเมล;
Email notifications;;no;yes;no;;Email notifications;;การแจ้งเตือนทางอีเมล;
Email subject;;no;yes;no;;Email subject;;หัวข้ออีเมล;
Employment;;no;yes;no;;Employment;;การจ้างงาน;
Empty;;no;yes;no;;Empty;;ว่างเปล่า;
Enable;;no;yes;no;;Enable;;เปิดใช้งาน;
Enable Feedback;;no;yes;no;;Enable Feedback;;เปิดใช้งานข้อเสนอแนะ;
End date;;no;yes;no;;End date;;วันที่สิ้นสุด;
Endorsed;;no;yes;no;;Endorsed;;รับรองแล้ว;
Enter;;no;yes;no;;Enter;;ป้อน;
Enter a name;;no;yes;no;;Enter a name;;ป้อนชื่อ;
Enter text;;no;yes;no;;Enter text;;กรอกข้อความ;
Entities;;no;yes;no;;Entities;;เอนทิตี;
Entities & fields;;no;yes;no;;Entities & fields;;เอนทิตีและฟิลด์;
Entity;;no;yes;no;;Entity;;เอนทิตี;
Entity details;;no;yes;no;;Entity details;;รายละเอียดเอนทิตี;
Entity enum;;no;yes;no;;Entity enum;;ค่า enum ของเอนทิตี;
Entity name;;no;yes;no;;Entity name;;ชื่อเอนทิตี;
Enum;;no;yes;no;;Enum;;เอนัม;
Equal to;;no;yes;no;;Equal to;;เท่ากับ;
Equity;;no;yes;no;;Equity;;ทุน;
Error;;no;yes;no;;Error;;ข้อผิดพลาด;
Errors;;no;yes;no;;Errors;;ข้อผิดพลาด;
Evaluation section;;no;yes;no;;Evaluation section;;ส่วนของการประเมิน;
Examples;;no;yes;no;;Examples;;ตัวอย่าง;
Exchange Rates;;no;yes;no;;Exchange Rates;;อัตราแลกเปลี่ยน;
Exchange rate;;no;yes;no;;Exchange rate;;อัตราแลกเปลี่ยน;
Exchange rate type;;no;yes;no;;Exchange rate type;;ประเภทอัตราแลกเปลี่ยน;
Exchange rates;;no;yes;no;;Exchange rates;;อัตราแลกเปลี่ยน;
Exclude;;no;yes;no;;Exclude;;ไม่รวม;
Exclude individuals;;no;yes;no;;Exclude individuals;;ยกเว้นบุคคล;
Excluded;;no;yes;no;;Excluded;;ยกเว้น;
Exit;;no;yes;no;;Exit;;ออก;
Exit without saving;;no;yes;no;;Exit without saving;;ออกโดยไม่บันทึก;
Expand;;no;yes;no;;Expand;;ขยาย;
Experience;;no;yes;no;;Experience;;ประสบการณ์;
Export;;no;yes;no;;Export;;ส่งออก;
Expression;;no;yes;no;;Expression;;การแสดงออก;
Expression formula;;no;yes;no;;Expression formula;;สูตรนิพจน์;
External;;no;yes;no;;External;;ภายนอก;
Failed;;no;yes;no;;Failed;;ล้มเหลว;
Favorite;;no;yes;no;;Favorite;;รายการโปรด;
Favorite feedback;;no;yes;no;;Favorite feedback;;ข้อเสนอแนะที่ชื่นชอบ;
Feature;;no;yes;no;;Feature;;คุณสมบัติ;
Feature Enablement;;no;yes;no;;Feature Enablement;;การเปิดใช้งานคุณสมบัติ;
Feature enablement;;no;yes;no;;Feature enablement;;การเปิดใช้งานฟีเจอร์;
Features;;no;yes;no;;Features;;คุณสมบัติ;
Feedback;;no;yes;no;;Feedback;;ฟีดแบค;
Feedback Ratings;;no;yes;no;;Feedback Ratings;;การให้คะแนนคำติชม;
Feedback from;;no;yes;no;;Feedback from;;ฟีดแบคจาก;
Feedback insights;;no;yes;no;;Feedback insights;;ข้อมูลเชิงลึกจากฟีดแบค;
Feedback note;;no;yes;no;;Feedback note;;หมายเหตุฟีดแบค;
Feedback notes;;no;yes;no;;Feedback notes;;บันทึกข้อเสนอแนะ;
Feedback rating;;no;yes;no;;Feedback rating;;คะแนนข้อเสนอแนะ;
Feedback received;;no;yes;no;;Feedback received;;ฟีดแบคที่ได้รับ;
Feedback request;;no;yes;no;;Feedback request;;คำขอฟีดแบค;
Feedback requested;;no;yes;no;;Feedback requested;;ฟีดแบคที่ขอ;
Feedback requests;;no;yes;no;;Feedback requests;;คำขอข้อเสนอแนะ;
Feedback sent;;no;yes;no;;Feedback sent;;ส่งฟีดแบคแล้ว;
Feedback sent to;;no;yes;no;;Feedback sent to;;ส่งฟีดแบคไปที่;
Field;;no;yes;no;;Field;;ฟิลด์;
Field name;;no;yes;no;;Field name;;ชื่อฟิลด์;
Fields;;no;yes;no;;Fields;;ฟิลด์;
Fields used;;no;yes;no;;Fields used;;ฟิลด์ที่ใช้;
File name;;no;yes;no;;File name;;ชื่อไฟล์;
File upload;;no;yes;no;;File upload;;อัปโหลดไฟล์;
Fill in the necessary details;;no;yes;no;;Fill in the necessary details;;กรอกข้อมูลที่จำเป็น;
Filter;;no;yes;no;;Filter;;ตัวกรอง;
Filters;;no;yes;no;;Filters;;ตัวกรอง;
Final;;no;yes;no;;Final;;สิ้นสุด;
Final Validation;;no;yes;no;;Final Validation;;การตรวจสอบความถูกต้องขั้นสุดท้าย;
Final validation;;no;yes;no;;Final validation;;การตรวจสอบความถูกต้องขั้นสุดท้าย;
Fixed;;no;yes;no;;Fixed;;คงที่;
For managers;;no;yes;no;;For managers;;สำหรับหัวหน้างาน;
For workers;;no;yes;no;;For workers;;สำหรับพนักงาน;
Formula;;no;yes;no;;Formula;;สูตร;
From;;no;yes;no;;From;;จาก;
Full name;;no;yes;no;;Full name;;ชื่อสกุล;
Functions;;no;yes;no;;Functions;;ฟังก์ชัน;
General;;no;yes;no;;General;;ทั่วไป;
General information;;no;yes;no;;General information;;ข้อมูลทั่วไป;
Generate;;no;yes;no;;Generate;;สร้าง;
Generate PDF;;no;yes;no;;Generate PDF;;สร้าง PDF;
Generated;;no;yes;no;;Generated;;สร้างขึ้น;
Generation date;;no;yes;no;;Generation date;;วันที่ผลิต;
Get started by creating one;;no;yes;no;;Get started by creating one;;เริ่มต้นด้วยการสร้างหนึ่งรายการ;
Give;;no;yes;no;;Give;;ให้;
Give feedback;;no;yes;no;;Give feedback;;ให้ฟีดแบค;
Global currency;;no;yes;no;;Global currency;;สกุลเงินสากล;
Global worker category;;no;yes;no;;Global worker category;;หมวดหมู่พนักงานระดับโลก;
Go to feedback;;no;yes;no;;Go to feedback;;ไปที่ฟีดแบค;
Goal;;no;yes;no;;Goal;;เป้าหมาย;
Goal Achievement;;no;yes;no;;Goal Achievement;;การบรรลุเป้าหมาย;
Goal Alignment;;no;yes;no;;Goal Alignment;;การปรับเป้าหมายให้สอดคล้องกัน;
Goal Details;;no;yes;no;;Goal Details;;รายละเอียดเป้าหมาย;
Goal ID;;no;yes;no;;Goal ID;;รหัสเป้าหมาย;
Goal Overview;;no;yes;no;;Goal Overview;;ภาพรวมเป้าหมาย;
Goal Plan;;no;yes;no;;Goal Plan;;แผนเป้าหมาย;
Goal Plans;;no;yes;no;;Goal Plans;;แผนเป้าหมาย;
Goal Status;;no;yes;no;;Goal Status;;สถานะเป้าหมาย;
Goal Tag Libraries;;no;yes;no;;Goal Tag Libraries;;ไลบรารีแท็กเป้าหมาย;
Goal Types;;no;yes;no;;Goal Types;;ประเภทเป้าหมาย;
Goal achievement;;no;yes;no;;Goal achievement;;การบรรลุเป้าหมาย;
Goal alignment;;no;yes;no;;Goal alignment;;การจัดตำแหน่งเป้าหมาย;
Goal creator;;no;yes;no;;Goal creator;;ผู้สร้างเป้าหมาย;
Goal details;;no;yes;no;;Goal details;;รายละเอียดเป้าหมาย;
Goal name;;no;yes;no;;Goal name;;ชื่อเป้าหมาย;
Goal overview;;no;yes;no;;Goal overview;;ภาพรวมเป้าหมาย;
Goal owner;;no;yes;no;;Goal owner;;เจ้าของเป้าหมาย;
Goal owner worker ID;;no;yes;no;;Goal owner worker ID;;รหัสพนักงานเจ้าของเป้าหมาย;
Goal period;;no;yes;no;;Goal period;;ช่วงเวลาเป้าหมาย;
Goal plan;;no;yes;no;;Goal plan;;แผนเป้าหมาย;
Goal plans;;no;yes;no;;Goal plans;;แผนเป้าหมาย;
Goal priority;;no;yes;no;;Goal priority;;ลำดับความสำคัญของเป้าหมาย;
Goal progress;;no;yes;no;;Goal progress;;ความคืบหน้าเป้าหมาย;
Goal status;;no;yes;no;;Goal status;;สถานะเป้าหมาย;
Goal tags;;no;yes;no;;Goal tags;;แท็กเป้าหมาย;
Goal title;;no;yes;no;;Goal title;;ชื่อเป้าหมาย;
Goal tracking status;;no;yes;no;;Goal tracking status;;สถานะการติดตามเป้าหมาย;
Goal type;;no;yes;no;;Goal type;;ประเภทเป้าหมาย;
Goal type weight;;no;yes;no;;Goal type weight;;ประเภทน้ำหนักของเป้าหมาย;
Goal types;;no;yes;no;;Goal types;;ประเภทเป้าหมาย;
Goal weight;;no;yes;no;;Goal weight;;น้ำหนักเป้าหมาย;
Goal workflow;;no;yes;no;;Goal workflow;;เวิร์กโฟลว์เป้าหมาย;
Goals;;no;yes;no;;Goals;;เป้าหมาย;
Goals aligned with this goal;;no;yes;no;;Goals aligned with this goal;;เป้าหมายที่สอดคล้องกับเป้าหมายนี้;
Grade;;no;yes;no;;Grade;;เกรด;
Grant date;;no;yes;no;;Grant date;;วันที่ได้รับสิทธิ์;
Grant proxy access;;no;yes;no;;Grant proxy access;;มอบสิทธิ์การเข้าถึงพร็อกซี;
Grants;;no;yes;no;;Grants;;การให้สิทธิ์;
Greater than;;no;yes;no;;Greater than;;มากกว่า;
Greater than or equal to;;no;yes;no;;Greater than or equal to;;มากกว่าหรือเท่ากับ;
Group name;;no;yes;no;;Group name;;ชื่อกลุ่ม;
Groups;;no;yes;no;;Groups;;กลุ่ม;
Guaranteed amount;;no;yes;no;;Guaranteed amount;;จำนวนที่รับประกัน;
Guaranteed amount rule;;no;yes;no;;Guaranteed amount rule;;กฎจำนวนเงินรับประกัน;
Guaranteed amounts;;no;yes;no;;Guaranteed amounts;;จำนวนที่รับประกัน;
Guideline;;no;yes;no;;Guideline;;แนวทางปฏิบัติ;
Guidelines;;no;yes;no;;Guidelines;;แนวทางปฏิบัติ;
HRBP approval;;no;yes;no;;HRBP approval;;การอนุมัติ HRBP;
HRBP review;;no;yes;no;;HRBP review;;การประเมินผลงาน HRBP;
Help;;no;yes;no;;Help;;ช่วยเหลือ;
Help tip;;no;yes;no;;Help tip;;เคล็ดลับวิธีใช้;
Helpful;;no;yes;no;;Helpful;;มีประโยชน์;
Hide;;no;yes;no;;Hide;;ซ่อน;
Hierarchy;;no;yes;no;;Hierarchy;;ลำดับชั้น;
High;;no;yes;no;;High;;สูง;
Historical Reviews;;no;yes;no;;Historical Reviews;;การประเมินผลงานในอดีต;
Historical compensation;;no;yes;no;;Historical compensation;;ค่าชดเชยย้อนหลัง;
Home;;no;yes;no;;Home;;หน้าหลัก;
Identifier;;no;yes;no;;Identifier;;ตัวระบุ;
Image;;no;yes;no;;Image;;ภาพ;
Import;;no;yes;no;;Import;;นำเข้า;
In progress;;no;yes;no;;In progress;;อยู่ระหว่างดำเนินการ;
In use;;no;yes;no;;In use;;กำลังใช้งาน;
Inactive;;no;yes;no;;Inactive;;ไม่ได้ใช้งาน;
Include;;no;yes;no;;Include;;รวม;
Included;;no;yes;no;;Included;;รวม;
Individual;;no;yes;no;;Individual;;รายบุคคล;
Individual goal;;no;yes;no;;Individual goal;;เป้าหมายรายบุคคล;
Individual goals;;no;yes;no;;Individual goals;;เป้าหมายรายบุคคล;
Individual view;;no;yes;no;;Individual view;;มุมมองรายบุคคล;
Individual workers;;no;yes;no;;Individual workers;;พนักงานรายบุคคล;
Individuals;;no;yes;no;;Individuals;;บุคคล;
Ingestion;;no;yes;no;;Ingestion;;การดึงข้อมูลเข้า;
Input;;no;yes;no;;Input;;อินพุต;
Insightful;;no;yes;no;;Insightful;;ข้อมูลเชิงลึก;
Insights;;no;yes;no;;Insights;;ข้อมูลเชิงลึก;
Inspiring;;no;yes;no;;Inspiring;;สร้างแรงบันดาลใจ;
Instant messaging address;;no;yes;no;;Instant messaging address;;ที่อยู่การส่งข้อความโต้ตอบแบบทันที;
Integer;;no;yes;no;;Integer;;จำนวนเต็ม;
Interface;;no;yes;no;;Interface;;อินเทอร์เฟซ;
Is PII;;no;yes;no;;Is PII;;คือ PII;
Is completed;;no;yes;no;;Is completed;;เสร็จสมบูรณ์แล้ว;
Is enabled;;no;yes;no;;Is enabled;;เปิดใช้งานแล้ว;
Is read;;no;yes;no;;Is read;;ถูกอ่านแล้ว;
Is required;;no;yes;no;;Is required;;จำเป็นต้องระบุ;
Job code;;no;yes;no;;Job code;;รหัสงาน;
Job level;;no;yes;no;;Job level;;ระดับงาน;
Job title;;no;yes;no;;Job title;;ชื่อตำแหน่งงาน;
Key dates;;no;yes;no;;Key dates;;วันที่สำคัญ;
Key deliverables;;no;yes;no;;Key deliverables;;สิ่งส่งมอบที่สำคัญ;
Label;;no;yes;no;;Label;;ป้ายกำกับ;
Language;;no;yes;no;;Language;;ภาษา;
Language code;;no;yes;no;;Language code;;รหัสภาษา;
Languages;;no;yes;no;;Languages;;ภาษา;
Last edited;;no;yes;no;;Last edited;;แก้ไขล่าสุด;
Last update;;no;yes;no;;Last update;;อัปเดตล่าสุด;
Last updated;;no;yes;no;;Last updated;;อัปเดตล่าสุด;
Learning;;no;yes;no;;Learning;;การเรียนรู้;
Leave of absence;;no;yes;no;;Leave of absence;;การลางาน;
Legal Entity;;no;yes;no;;Legal Entity;;นิติบุคคล;
Legal entity;;no;yes;no;;Legal entity;;นิติบุคคล;
Less than;;no;yes;no;;Less than;;น้อยกว่า;
Less than or equal to;;no;yes;no;;Less than or equal to;;น้อยกว่าหรือเท่ากับ;
Let's meet;;no;yes;no;;Let's meet;;มาพบปะกัน;
Library details;;no;yes;no;;Library details;;รายละเอียดไลบรารี;
Library name;;no;yes;no;;Library name;;ชื่อไลบรารี;
Limit;;no;yes;no;;Limit;;จำกัด;
Line manager;;no;yes;no;;Line manager;;หัวหน้างาน;
Linear curve;;no;yes;no;;Linear curve;;เส้นโค้งเชิงเส้น;
Link;;no;yes;no;;Link;;ลิงก์;
Local time;;no;yes;no;;Local time;;เวลาท้องถิ่น;
Local worker category;;no;yes;no;;Local worker category;;ประเภทพนักงานภายในประเทศ;
Localization;;no;yes;no;;Localization;;การแปลภาษา;
Location;;no;yes;no;;Location;;ที่ตั้ง;
Locations;;no;yes;no;;Locations;;สถานที่ตั้ง;
Logins;;no;yes;no;;Logins;;การเข้าสู่ระบบ;
Logins over time;;no;yes;no;;Logins over time;;การเข้าสู่ระบบตามช่วงเวลา;
Logout;;no;yes;no;;Logout;;ออกจากระบบ;
Low;;no;yes;no;;Low;;ต่ำ;
Main;;no;yes;no;;Main;;หลัก;
Main currency;;no;yes;no;;Main currency;;สกุลเงินหลัก;
Main group;;no;yes;no;;Main group;;กลุ่มหลัก;
Manage;;no;yes;no;;Manage;;จัดการ;
Manage users;;no;yes;no;;Manage users;;จัดการผู้ใช้;
Manager;;no;yes;no;;Manager;;หัวหน้างาน;
Manager + 1;;no;yes;no;;Manager + 1;;ผู้จัดการ + 1;
Manager ID;;no;yes;no;;Manager ID;;รหัสประจำตัวหัวหน้างาน;
Manager feedback;;no;yes;no;;Manager feedback;;ข้อเสนอแนะจากผู้จัดการ;
Manager name;;no;yes;no;;Manager name;;ชื่อผู้จัดการ;
Manager proposal;;no;yes;no;;Manager proposal;;ข้อเสนอของผู้จัดการ;
Manager review;;no;yes;no;;Manager review;;การประเมินโดยหัวหน้างาน;
Manager+1;;no;yes;no;;Manager+1;;ผู้จัดการ+1;
Managers;;no;yes;no;;Managers;;ผู้จัดการ;
Mandatory;;no;yes;no;;Mandatory;;บังคับ;
Manually;;no;yes;no;;Manually;;ด้วยตนเอง;
Mapping configuration;;no;yes;no;;Mapping configuration;;การกำหนดค่าการแมป;
Max target;;no;yes;no;;Max target;;เป้าหมายสูงสุด;
Max. score;;no;yes;no;;Max. score;;คะแนนสูงสุด;
Maximum;;no;yes;no;;Maximum;;สูงสุด;
Maximum outcome;;no;yes;no;;Maximum outcome;;ผลลัพธ์สูงสุด;
Maximum payout;;no;yes;no;;Maximum payout;;การจ่ายเงินสูงสุด;
Measurement;;no;yes;no;;Measurement;;การวัด;
Measurement criteria;;no;yes;no;;Measurement criteria;;เกณฑ์การวัดผล;
Medium;;no;yes;no;;Medium;;ปานกลาง;
Message;;no;yes;no;;Message;;ข้อความ;
Min target;;no;yes;no;;Min target;;เป้าหมายขั้นต่ำ;
Minimum;;no;yes;no;;Minimum;;ขั้นต่ำ;
Minimum outcome;;no;yes;no;;Minimum outcome;;ผลลัพธ์ขั้นต่ำ;
Model;;no;yes;no;;Model;;โมเดล;
Model description;;no;yes;no;;Model description;;คำอธิบายโมเดล;
Model details;;no;yes;no;;Model details;;รายละเอียดโมเดล;
Model features;;no;yes;no;;Model features;;คุณสมบัติของโมเดล;
Model name;;no;yes;no;;Model name;;ชื่อโมเดล;
Model type;;no;yes;no;;Model type;;ประเภทโมเดล;
Models;;no;yes;no;;Models;;โมเดล;
Moderation;;no;yes;no;;Moderation;;การกลั่นกรอง;
Moderation stage;;no;yes;no;;Moderation stage;;ขั้นตอนการกลั่นกรอง;
Month;;no;yes;no;;Month;;เดือน;
Months;;no;yes;no;;Months;;เดือน;
More;;no;yes;no;;More;;มากกว่า;
More details;;no;yes;no;;More details;;รายละเอียดเพิ่มเติม;
Move reviews;;no;yes;no;;Move reviews;;ย้ายการประเมินผลงาน;
Multiple;;no;yes;no;;Multiple;;หลายรายการ;
My behavior profile;;no;yes;no;;My behavior profile;;โปรไฟล์พฤติกรรมของฉัน;
My feedback;;no;yes;no;;My feedback;;ฟีดแบคของฉัน;
My goal;;no;yes;no;;My goal;;เป้าหมายของฉัน;
My goals;;no;yes;no;;My goals;;เป้าหมายของฉัน;
My note;;no;yes;no;;My note;;หมายเหตุของฉัน;
My review;;no;yes;no;;My review;;การประเมินผลงานของฉัน;
My reviews;;no;yes;no;;My reviews;;การตรวจสอบของฉัน;
Name;;no;yes;no;;Name;;ชื่อ;
New manager;;no;yes;no;;New manager;;ผู้จัดการคนใหม่;
New password;;no;yes;no;;New password;;รหัสผ่านใหม่;
Next;;no;yes;no;;Next;;ต่อไป;
Next step;;no;yes;no;;Next step;;ขั้นตอนต่อไป;
Nickname;;no;yes;no;;Nickname;;ชื่อเล่น;
No career development plans;;no;yes;no;;No career development plans;;ไม่มีแผนพัฒนาสายอาชีพ;
No check-ins;;no;yes;no;;No check-ins;;ไม่มีการเช็คอิน;
No comments yet;;no;yes;no;;No comments yet;;ยังไม่มีความคิดเห็น;
No compensation rounds;;no;yes;no;;No compensation rounds;;ไม่มีรอบการชดเชย;
No data;;no;yes;no;;No data;;ไม่มีข้อมูล;
No description;;no;yes;no;;No description;;ไม่มีคำอธิบาย;
No documents;;no;yes;no;;No documents;;ไม่มีเอกสาร;
No feedback;;no;yes;no;;No feedback;;ไม่มีฟีดแบค;
No goals;;no;yes;no;;No goals;;ไม่มีเป้าหมาย;
No goals yet;;no;yes;no;;No goals yet;;ยังไม่มีเป้าหมาย;
No messages yet;;no;yes;no;;No messages yet;;ยังไม่มีข้อความ;
No notes;;no;yes;no;;No notes;;ไม่มีหมายเหตุ;
No populations;;no;yes;no;;No populations;;ไม่มีประชากร;
No populations yet;;no;yes;no;;No populations yet;;ยังไม่มีประชากร;
No priority;;no;yes;no;;No priority;;ไม่มีลำดับความสำคัญ;
No questions;;no;yes;no;;No questions;;ไม่มีคำถาม;
