term;description;casesensitive;translatable;forbidden;tags;en-US;en-US_description;th-TH;th-TH_description
No results;;no;yes;no;;No results;;ไม่มีผลลัพธ์;
No results found;;no;yes;no;;No results found;;ไม่พบผลลัพธ์;
No value;;no;yes;no;;No value;;ไม่มีค่า;
Non-conditional;;no;yes;no;;Non-conditional;;ไม่เป็นเงื่อนไข;
None;;no;yes;no;;None;;ไม่มี;
Not completed;;no;yes;no;;Not completed;;ยังไม่เสร็จสมบูรณ์;
Not empty;;no;yes;no;;Not empty;;ไม่ว่างเปล่า;
Not released;;no;yes;no;;Not released;;ยังไม่ได้เผยแพร่;
Not selected;;no;yes;no;;Not selected;;ไม่ได้เลือก;
Not started;;no;yes;no;;Not started;;ยังไม่ได้เริ่มต้น;
Not submitted;;no;yes;no;;Not submitted;;ยังไม่ได้ส่ง;
Note;;no;yes;no;;Note;;หมายเหตุ;
Notes;;no;yes;no;;Notes;;หมายเหตุ;
Notification bell;;no;yes;no;;Notification bell;;กระดิ่งการแจ้งเตือน;
Notifications;;no;yes;no;;Notifications;;การแจ้งเตือน;
Nudge;;no;yes;no;;Nudge;;แจ้งเตือน;
Number;;no;yes;no;;Number;;หมายเลข;
Number of days;;no;yes;no;;Number of days;;จำนวนวัน;
Number of years;;no;yes;no;;Number of years;;จำนวนปี;
Numeric;;no;yes;no;;Numeric;;ตัวเลข;
Observations;;no;yes;no;;Observations;;การสังเกต;
On track;;no;yes;no;;On track;;อยู่บนเส้นทาง;
Open;;no;yes;no;;Open;;เปิด;
Operator;;no;yes;no;;Operator;;ผู้ดำเนินการ;
Optional;;no;yes;no;;Optional;;ไม่บังคับ;
Organization;;no;yes;no;;Organization;;องค์กร;
Organization external ID;;no;yes;no;;Organization external ID;;รหัสภายนอกองค์กร;
Organizational;;no;yes;no;;Organizational;;องค์กร;
Organizational Units;;no;yes;no;;Organizational Units;;หน่วยงาน;
Organizational goal;;no;yes;no;;Organizational goal;;เป้าหมายขององค์กร;
Organizational unit;;no;yes;no;;Organizational unit;;หน่วยงาน;
Other;;no;yes;no;;Other;;อื่นๆ;
Outcome;;no;yes;no;;Outcome;;ผลลัพธ์;
Outlook;;no;yes;no;;Outlook;;ภาพรวมแนวโน้ม;
Overall behavior rating;;no;yes;no;;Overall behavior rating;;คะแนนพฤติกรรมโดยรวม;
Overall performance;;no;yes;no;;Overall performance;;ผลการปฏิบัติงานโดยรวม;
Overall performance rating;;no;yes;no;;Overall performance rating;;คะแนนการประเมินผลงานโดยรวม;
Overall progress;;no;yes;no;;Overall progress;;ความคืบหน้าโดยรวม;
Overdue;;no;yes;no;;Overdue;;เกินกำหนด;
Overview;;no;yes;no;;Overview;;ภาพรวม;
Owner;;no;yes;no;;Owner;;เจ้าของ;
Owners;;no;yes;no;;Owners;;เจ้าของ;
Participant;;no;yes;no;;Participant;;ผู้เข้าร่วม;
Participants;;no;yes;no;;Participants;;ผู้เข้าร่วม;
Passport;;no;yes;no;;Passport;;หนังสือเดินทาง;
Password;;no;yes;no;;Password;;รหัสผ่าน;
Past;;no;yes;no;;Past;;อดีต;
Pay Analysis;;no;yes;no;;Pay Analysis;;การวิเคราะห์ค่าตอบแทน;
Pay Information;;no;yes;no;;Pay Information;;ข้อมูลเงินเดือน;
Pay Intelligence;;no;yes;no;;Pay Intelligence;;การจ่ายเงินอัจฉริยะ;
Pay Transparency;;no;yes;no;;Pay Transparency;;ความโปร่งใสในการชำระเงิน;
Pay analysis;;no;yes;no;;Pay analysis;;การวิเคราะห์ค่าตอบแทน;
Pay information;;no;yes;no;;Pay information;;ข้อมูลการจ่ายเงิน;
Pay information requests;;no;yes;no;;Pay information requests;;คำขอข้อมูลค่าตอบแทน;
Pay range;;no;yes;no;;Pay range;;ช่วงการจ่ายเงิน;
Payout;;no;yes;no;;Payout;;การจ่ายเงิน;
Payout Curves;;no;yes;no;;Payout Curves;;เส้นโค้งการจ่ายเงิน;
Payout curve;;no;yes;no;;Payout curve;;เส้นโค้งการจ่ายเงิน;
Payout curves;;no;yes;no;;Payout curves;;เส้นโค้งการจ่ายเงิน;
Payroll;;no;yes;no;;Payroll;;เงินเดือน;
Payroll data drop;;no;yes;no;;Payroll data drop;;การนำเข้าข้อมูลเงินเดือน;
Peers;;no;yes;no;;Peers;;เพื่อนร่วมงาน;
Pending;;no;yes;no;;Pending;;รอดำเนินการ;
Pending approval;;no;yes;no;;Pending approval;;รอการอนุมัติ;
Pending confirmation;;no;yes;no;;Pending confirmation;;รอการยืนยัน;
Pending draft;;no;yes;no;;Pending draft;;แบบร่างที่รอดำเนินการ;
Pending publishing;;no;yes;no;;Pending publishing;;รอการเผยแพร่;
Pending sign-off;;no;yes;no;;Pending sign-off;;รอการอนุมัติสิ้นสุด;
People;;no;yes;no;;People;;บุคลากร;
People day;;no;yes;no;;People day;;วันทรัพยากรบุคคล;
Percentage;;no;yes;no;;Percentage;;เปอร์เซ็นต์;
Performance;;no;yes;no;;Performance;;ผลการปฏิบัติงาน;
Performance Management;;no;yes;no;;Performance Management;;การจัดการประสิทธิภาพการทำงาน;
Performance Reviews;;no;yes;no;;Performance Reviews;;การประเมินผลการปฏิบัติงาน;
Performance check-ins;;no;yes;no;;Performance check-ins;;การเช็คอินการปฏิบัติงาน;
Performance rating;;no;yes;no;;Performance rating;;คะแนนประสิทธิภาพการทำงาน;
Performance review;;no;yes;no;;Performance review;;การประเมินผลการปฏิบัติงาน;
Performance review details;;no;yes;no;;Performance review details;;รายละเอียดการประเมินผลการปฏิบัติงาน;
Performance review templates;;no;yes;no;;Performance review templates;;แม่แบบการประเมินผลงาน;
Period start date;;no;yes;no;;Period start date;;วันที่เริ่มต้นของรอบระยะเวลา;
Personal;;no;yes;no;;Personal;;ส่วนตัว;
Personally identifiable information;;no;yes;no;;Personally identifiable information;;ข้อมูลระบุตัวตนส่วนบุคคล;
Phone number;;no;yes;no;;Phone number;;หมายเลขโทรศัพท์;
Plan;;no;yes;no;;Plan;;แผน;
Plan details;;no;yes;no;;Plan details;;รายละเอียดแผน;
Plan name;;no;yes;no;;Plan name;;ชื่อแผน;
Plan stage;;no;yes;no;;Plan stage;;ขั้นตอนการวางแผน;
Plan transmission;;no;yes;no;;Plan transmission;;การส่งแผน;
Planner;;no;yes;no;;Planner;;แพลนเนอร์;
Plans;;no;yes;no;;Plans;;แผน;
Population;;no;yes;no;;Population;;ประชากร;
Population criteria;;no;yes;no;;Population criteria;;เกณฑ์ประชากร;
Populations;;no;yes;no;;Populations;;ประชากร;
Position in pay range;;no;yes;no;;Position in pay range;;ตำแหน่งในช่วงเงินเดือน;
Preview;;no;yes;no;;Preview;;ดูตัวอย่าง;
Preview document;;no;yes;no;;Preview document;;ดูตัวอย่างเอกสาร;
Previous;;no;yes;no;;Previous;;ก่อนหน้า;
Priority;;no;yes;no;;Priority;;ลำดับความสำคัญ;
Privacy;;no;yes;no;;Privacy;;ความเป็นส่วนตัว;
Privacy settings;;no;yes;no;;Privacy settings;;การตั้งค่าความเป็นส่วนตัว;
Privacy statement text;;no;yes;no;;Privacy statement text;;ข้อความแถลงการณ์ความเป็นส่วนตัว;
Private;;no;yes;no;;Private;;ส่วนตัว;
Proceed;;no;yes;no;;Proceed;;ดำเนินการ;
Processing;;no;yes;no;;Processing;;กำลังประมวลผล;
Professional;;no;yes;no;;Professional;;มืออาชีพ;
Progress;;no;yes;no;;Progress;;ความคืบหน้า;
Progress tracking;;no;yes;no;;Progress tracking;;การติดตามความคืบหน้า;
Properties;;no;yes;no;;Properties;;คุณสมบัติ;
Proposal management;;no;yes;no;;Proposal management;;การจัดการข้อเสนอ;
Prorated target bonus;;no;yes;no;;Prorated target bonus;;เป้าหมายโบนัสแบบคำนวณตามสัดส่วน;
Proxy;;no;yes;no;;Proxy;;พร็อกซี;
Proxy access list;;no;yes;no;;Proxy access list;;รายการการเข้าถึงพร็อกซี;
Proxy permission;;no;yes;no;;Proxy permission;;สิทธิ์การอนุญาตใช้พร็อกซี;
Public;;no;yes;no;;Public;;สาธารณะ;
Public feedback;;no;yes;no;;Public feedback;;ข้อเสนอแนะสาธารณะ;
Publish;;no;yes;no;;Publish;;เผยแพร่;
Published;;no;yes;no;;Published;;เผยแพร่แล้ว;
Published date;;no;yes;no;;Published date;;วันที่เผยแพร่;
Publishing;;no;yes;no;;Publishing;;การเผยแพร่;
Purpose;;no;yes;no;;Purpose;;วัตถุประสงค์;
Question;;no;yes;no;;Question;;คำถาม;
Questions;;no;yes;no;;Questions;;คำถาม;
RTI request status;;no;yes;no;;RTI request status;;สถานะคำขอ RTI;
Range;;no;yes;no;;Range;;ช่วง;
Rate this feedback;;no;yes;no;;Rate this feedback;;ให้คะแนนฟีดแบคนี้;
Rating;;no;yes;no;;Rating;;การจัดอันดับ;
Rating changed;;no;yes;no;;Rating changed;;มีการเปลี่ยนแปลงคะแนน;
Rating distribution;;no;yes;no;;Rating distribution;;การกระจายระดับคะแนน;
Rating scale;;no;yes;no;;Rating scale;;มาตราวัดการให้คะแนน;
Rating scales;;no;yes;no;;Rating scales;;มาตรการให้คะแนน;
Read;;no;yes;no;;Read;;อ่าน;
Read only;;no;yes;no;;Read only;;เฉพาะอ่านเท่านั้น;
Read status;;no;yes;no;;Read status;;สถานะการอ่าน;
Read-only;;no;yes;no;;Read-only;;อ่านอย่างเดียว;
Ready;;no;yes;no;;Ready;;พร้อม;
Reassign;;no;yes;no;;Reassign;;มอบหมายใหม่;
Reassign manager;;no;yes;no;;Reassign manager;;มอบหมายผู้จัดการใหม่;
Reassigned;;no;yes;no;;Reassigned;;ถูกมอบหมายใหม่;
Received;;no;yes;no;;Received;;ได้รับแล้ว;
Received behaviors;;no;yes;no;;Received behaviors;;พฤติกรรมที่ได้รับ;
Received feedback;;no;yes;no;;Received feedback;;ฟีดแบคที่ได้รับ;
Recipient;;no;yes;no;;Recipient;;ผู้รับ;
Recipients;;no;yes;no;;Recipients;;ผู้รับ;
Recognition;;no;yes;no;;Recognition;;การยอมรับ;
Recognized behaviors;;no;yes;no;;Recognized behaviors;;พฤติกรรมที่ได้รับการยอมรับ;
Recommended;;no;yes;no;;Recommended;;แนะนำ;
Recurrence;;no;yes;no;;Recurrence;;การเกิดซ้ำ;
Reference;;no;yes;no;;Reference;;การอ้างอิง;
Reference number;;no;yes;no;;Reference number;;หมายเลขอ้างอิง;
Refresh;;no;yes;no;;Refresh;;รีเฟรช;
Region;;no;yes;no;;Region;;ภูมิภาค;
Regular;;no;yes;no;;Regular;;ปกติ;
Regular check-ins;;no;yes;no;;Regular check-ins;;การเช็คอินเป็นประจำ;
Reject;;no;yes;no;;Reject;;ปฏิเสธ;
Rejected;;no;yes;no;;Rejected;;ปฏิเสธแล้ว;
Relation;;no;yes;no;;Relation;;ความสัมพันธ์;
Release;;no;yes;no;;Release;;เผยแพร่;
Release status;;no;yes;no;;Release status;;สถานะการเผยแพร่;
Released;;no;yes;no;;Released;;เผยแพร่แล้ว;
Remaining;;no;yes;no;;Remaining;;ที่เหลืออยู่;
Reminder name;;no;yes;no;;Reminder name;;ชื่อการเตือนความจำ;
Reminders;;no;yes;no;;Reminders;;การแจ้งเตือน;
Remove;;no;yes;no;;Remove;;ลบออก;
Remove all;;no;yes;no;;Remove all;;ลบทั้งหมด;
Rename;;no;yes;no;;Rename;;เปลี่ยนชื่อ;
Reopen;;no;yes;no;;Reopen;;เปิดใหม่อีกครั้ง;
Reopen reviews;;no;yes;no;;Reopen reviews;;เปิดการประเมินอีกครั้ง;
Reopened;;no;yes;no;;Reopened;;เปิดใหม่อีกครั้ง;
Reply rate;;no;yes;no;;Reply rate;;อัตราการตอบกลับ;
Reports;;no;yes;no;;Reports;;รายงาน;
Republish;;no;yes;no;;Republish;;เผยแพร่ซ้ำ;
Republished round;;no;yes;no;;Republished round;;รอบการเผยแพร่ซ้ำ;
Request;;no;yes;no;;Request;;ขอ;
Request ID;;no;yes;no;;Request ID;;รหัสคำขอ;
Request date;;no;yes;no;;Request date;;วันที่คำขอ;
Request details;;no;yes;no;;Request details;;รายละเอียดคำร้องขอ;
Request feedback;;no;yes;no;;Request feedback;;ขอฟีคแบค;
Request feedback from;;no;yes;no;;Request feedback from;;ขอฟีดแบคจาก;
Request feedback now;;no;yes;no;;Request feedback now;;ขอฟีดแบคตอนนี้;
Request feedback on;;no;yes;no;;Request feedback on;;ขอฟีดแบคเกี่ยวกับ;
Request pay information;;no;yes;no;;Request pay information;;ขอข้อมูลการจ่ายเงิน;
Request status;;no;yes;no;;Request status;;สถานะคำขอ;
Requested;;no;yes;no;;Requested;;ส่งคำขอแล้ว;
Requested feedback;;no;yes;no;;Requested feedback;;ขอฟีดแบคแล้ว;
Requests;;no;yes;no;;Requests;;คำขอ;
Requests about my team;;no;yes;no;;Requests about my team;;คำขอเกี่ยวกับทีมของฉัน;
Required;;no;yes;no;;Required;;ที่จำเป็น;
Resources;;no;yes;no;;Resources;;ทรัพยากร;
Response permission;;no;yes;no;;Response permission;;สิทธิ์การตอบกลับ;
Resubmit;;no;yes;no;;Resubmit;;ส่งใหม่อีกครั้ง;
Result;;no;yes;no;;Result;;ผลลัพธ์;
Review;;no;yes;no;;Review;;การตรวจสอบ;
Review Details;;no;yes;no;;Review Details;;รายละเอียดการทบทวน;
Review Status;;no;yes;no;;Review Status;;สถานะการทบทวน;
Review about;;no;yes;no;;Review about;;การตรวจสอบเกี่ยวกับ;
Review challenge;;no;yes;no;;Review challenge;;ท้าทายผลการประเมิน;
Review name;;no;yes;no;;Review name;;ชื่อการประเมิน;
Review rating;;no;yes;no;;Review rating;;คะแนนการประเมิน;
Review rating distribution;;no;yes;no;;Review rating distribution;;การกระจายเรตติ้งของการทบทวน;
Review settings;;no;yes;no;;Review settings;;การตั้งค่าการประเมินผลงาน;
Review stage;;no;yes;no;;Review stage;;ขั้นตอนการประเมินผลงาน;
Review stages;;no;yes;no;;Review stages;;ขั้นตอนการประเมินผลงาน;
Review status;;no;yes;no;;Review status;;สถานะการประเมินผลงาน;
Review type;;no;yes;no;;Review type;;ประเภทการประเมินผลงาน;
Reviews;;no;yes;no;;Reviews;;การตรวจสอบ;
Role;;no;yes;no;;Role;;บทบาท;
Roles;;no;yes;no;;Roles;;บทบาท;
Round;;no;yes;no;;Round;;รอบ;
Round code;;no;yes;no;;Round code;;รหัสรอบ;
Round details;;no;yes;no;;Round details;;รายละเอียดรอบ;
Round reminders;;no;yes;no;;Round reminders;;การเตือนในรอบ;
Round republished;;no;yes;no;;Round republished;;รอบถูกเผยแพร่อีกครั้ง;
Round type;;no;yes;no;;Round type;;ประเภทของรอบ;
Round visibility;;no;yes;no;;Round visibility;;การมองเห็นของรอบ;
Rule configuration;;no;yes;no;;Rule configuration;;การกำหนดค่ากฎ;
Rule details;;no;yes;no;;Rule details;;รายละเอียดกฎ;
Rule name;;no;yes;no;;Rule name;;ชื่อกฎ;
Rules;;no;yes;no;;Rules;;กฎ;
Salary;;no;yes;no;;Salary;;เงินเดือน;
Salary configuration;;no;yes;no;;Salary configuration;;การกำหนดค่าระบบเงินเดือน;
Save;;no;yes;no;;Save;;บันทึก;
Save & exit;;no;yes;no;;Save & exit;;บันทึกและออก;
Scale;;no;yes;no;;Scale;;ขนาด;
Search;;no;yes;no;;Search;;ค้นหา;
Search by name;;no;yes;no;;Search by name;;ค้นหาตามชื่อ;
Search by name or code;;no;yes;no;;Search by name or code;;ค้นหาด้วยชื่อหรือรหัส;
Search for a person;;no;yes;no;;Search for a person;;ค้นหาบุคคล;
Search for a worker;;no;yes;no;;Search for a worker;;ค้นหาพนักงาน;
Search for workers;;no;yes;no;;Search for workers;;ค้นหาพนักงาน;
Secondary email;;no;yes;no;;Secondary email;;อีเมลสำรอง;
Secondary email address;;no;yes;no;;Secondary email address;;ที่อยู่อีเมลรอง;
Secondary hierarchy;;no;yes;no;;Secondary hierarchy;;ลำดับชั้นรอง;
Section header;;no;yes;no;;Section header;;หัวข้อส่วน;
Security;;no;yes;no;;Security;;ความปลอดภัย;
Security group;;no;yes;no;;Security group;;กลุ่มความปลอดภัย;
See all;;no;yes;no;;See all;;ดูทั้งหมด;
Select;;no;yes;no;;Select;;เลือก;
Select all;;no;yes;no;;Select all;;เลือกทั้งหมด;
Select an option;;no;yes;no;;Select an option;;เลือกตัวเลือก;
Select communication round;;no;yes;no;;Select communication round;;เลือกช่วงการสื่อสาร;
Select data model;;no;yes;no;;Select data model;;เลือกแบบจำลองข้อมูล;
Select entity;;no;yes;no;;Select entity;;เลือกเอนทิตี;
Select filters;;no;yes;no;;Select filters;;เลือกตัวกรอง;
Select goal;;no;yes;no;;Select goal;;เลือกเป้าหมาย;
Select owners;;no;yes;no;;Select owners;;เลือกเจ้าของ;
Select population;;no;yes;no;;Select population;;เลือกกลุ่มพนักงาน;
Select the compensation element;;no;yes;no;;Select the compensation element;;เลือกองค์ประกอบค่าตอบแทน;
Select type;;no;yes;no;;Select type;;เลือกประเภท;
Selected;;no;yes;no;;Selected;;เลือกแล้ว;
Selected column;;no;yes;no;;Selected column;;คอลัมน์ที่เลือก;
Selected fields;;no;yes;no;;Selected fields;;ฟิลด์ที่เลือก;
Selected items;;no;yes;no;;Selected items;;รายการที่เลือก;
Selected population;;no;yes;no;;Selected population;;กลุ่มพนักงานที่เลือก;
Self;;no;yes;no;;Self;;ตัวเอง;
Self-assessment;;no;yes;no;;Self-assessment;;การประเมินตนเอง;
Self-review;;no;yes;no;;Self-review;;การประเมินตนเอง;
Send;;no;yes;no;;Send;;ส่ง;
Send feedback;;no;yes;no;;Send feedback;;ส่งฟีดแบค;
Send to Documents;;no;yes;no;;Send to Documents;;ส่งไปยังเอกสาร;
Sender;;no;yes;no;;Sender;;ผู้ส่ง;
Sensitive Content;;no;yes;no;;Sensitive Content;;เนื้อหาที่ละเอียดอ่อน;
Sent;;no;yes;no;;Sent;;ส่งแล้ว;
Sent behaviors;;no;yes;no;;Sent behaviors;;พฤติกรรมที่ส่งแล้ว;
Sent feedback;;no;yes;no;;Sent feedback;;ส่งฟีดแบคแล้ว;
Sent to;;no;yes;no;;Sent to;;ส่งถึง;
Separator;;no;yes;no;;Separator;;ตัวคั่น;
Session timeout;;no;yes;no;;Session timeout;;หมดเวลาเซสชัน;
Settings;;no;yes;no;;Settings;;การตั้งค่า;
Share;;no;yes;no;;Share;;แบ่งปัน;
Share feedback;;no;yes;no;;Share feedback;;แบ่งปันฟีดแบค;
Share this feedback;;no;yes;no;;Share this feedback;;แบ่งปันฟีดแบคนี้;
Share with;;no;yes;no;;Share with;;แบ่งปันกับ;
Share your insights;;no;yes;no;;Share your insights;;แบ่งปันข้อมูลเชิงลึกของคุณ;
Share your thoughts;;no;yes;no;;Share your thoughts;;แบ่งปันความคิดของคุณ;
Shared;;no;yes;no;;Shared;;แบ่งปันแล้ว;
Shared feedback;;no;yes;no;;Shared feedback;;ฟีดแบคที่แบ่งปัน;
Shared goals;;no;yes;no;;Shared goals;;เป้าหมายร่วมกัน;
Shared with;;no;yes;no;;Shared with;;แบ่งปันแล้วกับ;
Shared with me;;no;yes;no;;Shared with me;;แบ่งปันกับฉัน;
Sharing;;no;yes;no;;Sharing;;การแบ่งปัน;
Short;;no;yes;no;;Short;;สั้น;
Show;;no;yes;no;;Show;;แสดง;
Show all;;no;yes;no;;Show all;;แสดงทั้งหมด;
Since request;;no;yes;no;;Since request;;ตั้งแต่มีการร้องขอ;
Situation;;no;yes;no;;Situation;;สถานการณ์;
Situations;;no;yes;no;;Situations;;สถานการณ์;
Skill & Competency Groups;;no;yes;no;;Skill & Competency Groups;;กลุ่มทักษะและความสามารถ;
Skill & competency groups;;no;yes;no;;Skill & competency groups;;กลุ่มทักษะและความสามารถ;
Skills;;no;yes;no;;Skills;;ทักษะ;
Skills & competency groups;;no;yes;no;;Skills & competency groups;;กลุ่มทักษะและความสามารถ;
Snapshot;;no;yes;no;;Snapshot;;สแน็ปช็อต;
Snapshot Manager;;no;yes;no;;Snapshot Manager;;ตัวจัดการ Snapshot;
Snapshot details;;no;yes;no;;Snapshot details;;รายละเอียด Snapshot;
Snapshots;;no;yes;no;;Snapshots;;สแนปชอต;
Source;;no;yes;no;;Source;;แหล่งที่มา;
Stage;;no;yes;no;;Stage;;ขั้นตอน;
Standard;;no;yes;no;;Standard;;มาตรฐาน;
Start;;no;yes;no;;Start;;เริ่มต้น;
Start date;;no;yes;no;;Start date;;วันที่เริ่มต้น;
Start date in company;;no;yes;no;;Start date in company;;วันที่เริ่มงานในบริษัท;
Start time;;no;yes;no;;Start time;;เวลาเริ่มต้น;
State;;no;yes;no;;State;;รัฐ;
Statement generation;;no;yes;no;;Statement generation;;การสร้างรายงานบัญชี;
Statements;;no;yes;no;;Statements;;คำชี้แจง;
Status;;no;yes;no;;Status;;สถานะ;
Status by org. level;;no;yes;no;;Status by org. level;;สถานะตามระดับองค์กร;
Step curve;;no;yes;no;;Step curve;;ขั้นบันได;
Step end date;;no;yes;no;;Step end date;;วันที่สิ้นสุดขั้นตอน;
Stock;;no;yes;no;;Stock;;สต็อก;
Street address;;no;yes;no;;Street address;;ที่อยู่ถนน;
Subgroups;;no;yes;no;;Subgroups;;กลุ่มย่อย;
Subject;;no;yes;no;;Subject;;เรื่อง;
Submit;;no;yes;no;;Submit;;ส่ง;
Submit to manager;;no;yes;no;;Submit to manager;;ส่งให้หัวหน้างาน;
Submitted;;no;yes;no;;Submitted;;ส่งแล้ว;
Success;;no;yes;no;;Success;;สำเร็จ;
Suggested agenda;;no;yes;no;;Suggested agenda;;วาระการประชุมที่แนะนำ;
Sum;;no;yes;no;;Sum;;ผลรวม;
Summary;;no;yes;no;;Summary;;สรุป;
System;;no;yes;no;;System;;ระบบ;
System populations;;no;yes;no;;System populations;;กลุ่มประชากรของระบบ;
